commodity,currency,description,symbol,uom
Natural gas,USD,Chicago Peoples FDt Midpoint Prelim MAvg,PSBGX06,MMB
Natural gas,USD,Emerson Viking FDt Midpoint Prelim MAvg,PSBCW06,MMB
Natural gas,N/A,Col Gulf Mnline Wk Tot Vol,IGBBHV4,MMB
Natural gas,USD,Chicago Nicor Prelim WAvg,PRBEX04,MMB
Natural gas,USD,White River Hub Prelim WAvg,PRBGL04,MMB
Natural gas,USD,Tennessee Zone 6 delivered South Prelim WAvg,PRBRS04,MMB
Natural gas,N/A,Pine Prairie Hub Tier Mo,CGBRU03,N/A
Natural gas,USD,TX Eastern STX FDt Midpoint Prelim MAvg,PSBBB06,MMB
Natural gas,UNS,Transco Zone 6 Non-NY North Tier Mo,CGBJS03,N/A
Natural gas,N/A,ANR ML 7 Wk Tot Vol,IGBDQV4,MMB
Natural gas,UNS,Northwest S. of Green River DlCt Mo,BGBYT03,CON
Natural gas,USD,Niagara FDt Midpoint Prelim MAvg,PSBCS06,MMB
Natural gas,USD,TX Eastern M-1 24-in Prelim WAvg,PRBET04,MMB
Natural gas,USD,No Border VentTP Prelim WAvg,PRBGH04,MMB
Natural gas,USD,Transco Zone 6 Non-NY North WAvg,IGBJS04,MMB
Natural gas,USD,Carthage Hub FDt Midpoint Prelim MAvg,PSBAF06,MMB
Natural gas,N/A,Millennium East receipts Tier Mo,CGBIW03,N/A
Natural gas,USD,REX Zone 3 delivered Prelim WAvg,PRBRO04,MMB
Natural gas,N/A,TC Alb AECO-C Wk Tot Vol Dly,IGBCUV4,GIG
Natural gas,USD,Chicago NIPSCO FDt Midpoint Prelim MAvg,PSBFX06,MMB
Natural gas,USD,Algonquin Rcpts FDt Midpt Prelim MAvg,PSBDK06,MMB
Natural gas,USD,Chicago CG Prelim WAvg,PRBDX04,MMB
Natural gas,USD,Northwest Wyoming Pool BidWk Dlvd Pipe,IGBDA36,MMB
Natural gas,N/A,ANR OK Wk Tot Vol,IGBBYV4,MMB
Natural gas,USD,Northwest S. of Green River BidWk Dlvd Pipe Cash,EGBYT36,MMB
Natural gas,USD,Northwest Rocky Mountain Pool FDt Midpt Prelim MAvg,PSBRW06,MMB
Natural gas,USD,Cheyenne Hub FDt Midpt Prelim MAvg,PSBCO06,MMB
Natural gas,USD,Northwest Wyoming Pool Tier Mo,CGBDA03,MMB
Natural gas,UNS,Transco Leidy Line receipts Tier Mo,CGBIS03,N/A
Natural gas,N/A,NW S of Grn Rvr Wk Tot Vol,IGBCQV4,MMB
Natural gas,UNS,Katy Tier Mo,CGBAQ03,UNS
Natural gas,USD,TX Eastern ELA FDt Midpt Prelim MAvg,PSBBS06,MMB
Natural gas,N/A,Waha Wk Tot Vol,IGBADV4,MMB
Natural gas,UNS,Panhandle TX-OK Tier Mo,CGBCE03,UNS
Natural gas,USD,ICE Midcoast Carthage Hub BidWk Dlvd Pipe,JADLZ36,MMB
Natural gas,USD,Col Gulf LA Prelim WAvg,PRBBG04,MMB
Natural gas,USD,Chicago Nicor FDt Midpoint Prelim MAvg,PSBEX06,MMB
Natural gas,UNS,Lebanon Hub Tier Mo,CGBFJ03,UNS
Natural gas,USD,White River Hub FDt Midpt Prelim MAvg,PSBGL06,MMB
Natural gas,USD,Tennessee Zone 6 delivered South FDt Midpoint Prelim MAvg,PSBRS06,MMB
Natural gas,USD,Dawn Ontario Prelim WAvg,PRBCX04,MMB
Natural gas,N/A,Westcoast Station 2 BidWeek Delivered-to-Pipeline liquidity tier,CGBCZ03,N/A
Natural gas,N/A,Stanfield OR Wk Tot Vol,IGBCMV4,MMB
Natural gas,UNS,Northwest S. of Green River BidWk Dlvd Pipe DlCt,BGBYT36,CON
Natural gas,USD,Texas Eastern zone M-2 receipts Prelim WAvg,PRBJE04,MMB
Natural gas,N/A,Transco Zone 6 Non-NY North Wk Tot Vol,IGBJSV4,MMB
Natural gas,USD,Alliance Interstates Prelim WAvg,PRBDP04,MMB
Natural gas,USD,TX East M-1 24-in FDt Midpt Prelim MAvg,PSBET06,MMB
Natural gas,USD,No Border VentTP FDt Midpt Prelim MAvg,PSBGH06,MMB
Natural gas,USD,REX Zone 3 delivered FDt Midpoint Prelim MAvg,PSBRO06,MMB
Natural gas,N/A,Millennium East receipts Wk Tot Vol,IGBIWV4,MMB
Natural gas,USD,NW Can Bd Sumas Prelim WAvg,PRBCT04,MMB
Natural gas,USD,Chicago CG FDt Midpoint Prelim MAvg,PSBDX06,MMB
Natural gas,N/A,Transco Leidy Line receipts Wk Tot Vol,IGBISV4,MMB
Natural gas,USD,NW WY Pool/Rky Prelim WAvg,PRBCP04,MMB
Natural gas,USD,Florida CG Prelim WAvg,PRBED04,MMB
Natural gas,N/A,Katy Wk Tot Vol,IGBAQV4,MMB
Natural gas,N/A,Panhandle TX-OK Wk Tot Vol,IGBCEV4,MMB
Natural gas,USD,Tennessee Zone 1 Prelim WAvg,PRBHI04,MMB
Natural gas,UNS,Transwestn Perm Tier Mo,CGBAE03,UNS
Natural gas,USD,Col Gulf LA FDt Midpoint Prelim MAvg,PSBBG06,MMB
Natural gas,N/A,Tennessee Zone 6 delivered South Tier Mo,CGBJX03,N/A
Natural gas,N/A,Lebanon Hub-Ohio Wk Tot Vol,IGBFJV4,MMB
Natural gas,USD,Dawn Ontario FDt Midpoint Prelim MAvg,PSBCX06,MMB
Natural gas,USD,El Paso West Texas Prelim WAvg,PRBRT04,MMB
Natural gas,N/A,Westcoast Stn 2 Wk Tot Vol,IGBCZV4,GIG
Natural gas,USD,Houston ShipChl Burner Tip SPI,RGBAP76,MMB
Natural gas,USD,Texas Eastern zone M-2 receipts FDt Midpoint Prelim MAvg,PSBJE06,MMB
Natural gas,N/A,Rover delivered Tier Mo,CGBRV03,N/A
Natural gas,USD,Alliance Interstates FDt MidPrelim MAvg,PSBDP06,MMB
Natural gas,UNS,Transco Zone 6 Non-NY South Tier Mo,CGBJT03,N/A
Natural gas,USD,Leidy Hub Prelim WAvg,PRBDD04,MMB
Natural gas,UNS,TX Eastern W LA Tier Mo,CGBBR03,UNS
Natural gas,USD,NW Can Bd Sumas FDt Midpt Prelim MAvg,PSBCT06,MMB
Natural gas,USD,Iroquois zone 1 (delivered excl. Waddington) Prelim WAvg,PRBRP04,MMB
Natural gas,UNS,Transwestern-SJ Tier Mo,CGBGK03,UNS
Natural gas,USD,Cons Energy CG Prelim WAvg,PRBDY04,MMB
Natural gas,UNS,ICE REX zone 3 delivered Pool DlCt Mo,JDDQR03,CON
Natural gas,USD,NW WY Pool/Rocky FDt Midpt Prelim MAvg,PSBCP06,MMB
Natural gas,USD,Florida CG FDt Midpoint Prelim MAvg,PSBED06,MMB
Natural gas,USD,Oneok OK Prelim WAvg,PRBCD04,MMB
Natural gas,USD,Northwest S. of Green River BidWk Dlvd Pipe,IGBYT36,MMB
Natural gas,USD,Tennessee Zone 1 FDt Midpt Prelim MAvg,PSBHI06,MMB
Natural gas,N/A,Transwestn Perm Wk Tot Vol,IGBAEV4,MMB
Natural gas,USD,Nrthrn Ventura Prelim WAvg,PRBDU04,MMB
Natural gas,USD,Northwest S. of Green River Tier Mo,CGBYT03,MMB
Natural gas,USD,Col Gulf Mnline Prelim WAvg,PRBBH04,MMB
Natural gas,USD,El Paso West Texas FDt Midpoint Prelim MAvg,PSBRT06,MMB
Natural gas,USD,ICE REX zone 3 delivered Pool Mo,JAAQR03,MMB
Natural gas,UNS,ICE Midcoast Carthage Hub DlCt Mo,JEDLZ03,CON
Natural gas,UNS,TX Eastern E TX Tier Mo,CGBAN03,UNS
Natural gas,USD,Leidy Hub FDt Midpoint Prelim MAvg,PSBDD06,MMB
Natural gas,N/A,Transco Zone 6 Non-NY South Wk Tot Vol,IGBJTV4,MMB
Natural gas,USD,ANR ML 7 Prelim WAvg,PRBDQ04,MMB
Natural gas,N/A,TX Eastern W LA Wk Tot Vol,IGBBRV4,MMB
Natural gas,UNS,ANR LA Tier Mo,CGBBF03,UNS
Natural gas,USD,Iroquois zone 1 (delivered excl. Waddington) FDt Midpoint Prelim MAvg,PSBRP06,MMB
Natural gas,CAD,TC Alb AECO-C Prelim WAvg,PRBCU04,GIG
Natural gas,UNS,ICE REX zone 3 delivered Pool BidWk Dlvd Pipe DlCt,JDDQR36,CON
Natural gas,UNS,Chicago Peoples Tier Mo,CGBGX03,N/A
Natural gas,N/A,Transwestern-SJ Wk Tot Vol,IGBGKV4,MMB
Natural gas,UNS,Emerson Viking Tier Mo,CGBCW03,UNS
Natural gas,USD,Cons Energy CG FDt Midpt Prelim MAvg,PSBDY06,MMB
Natural gas,UNS,TX Eastern M-3 Tier Mo,CGBEK03,UNS
Natural gas,USD,Henry Hub FDt Midpoint Prelim MAvg,PSBBL06,MMB
Natural gas,USD,ANR OK Prelim WAvg,PRBBY04,MMB
Natural gas,USD,Houston ShpChl FDt Midpt Prelim MAvg,PSBAP06,MMB
Natural gas,UNS,TX Eastern S TX Tier Mo,CGBBB03,UNS
Natural gas,USD,Oneok OK FDt Midpoint Prelim MAvg,PSBCD06,MMB
Natural gas,USD,NW S of Grn Rvr Prelim WAvg,PRBCQ04,MMB
Natural gas,USD,Algonquin CG Prelim WAvg,PRBEE04,MMB
Natural gas,USD,Waha Prelim WAvg,PRBAD04,MMB
Natural gas,USD,TX Eastern ZnM1 24-in Mo,IGBET03,MMB
Natural gas,UNS,Niagra Tier Mo,CGBCS03,UNS
Natural gas,USD,Northern Ventura FDt Midpt Prelim MAvg,PSBDU06,MMB
Natural gas,USD,Col Gulf Mainline FDt Midpt Prelim MAvg,PSBBH06,MMB
Natural gas,UNS,ICE GCX Waha Hub Pool DlCt Mo,JDDMZ03,CON
Natural gas,USD,ICE REX zone 3 delivered Pool BidWk Dlvd Pipe,JAAQR36,MMB
Natural gas,UNS,ICE Midcoast Carthage Hub BidWk Dlvd Pipe DlCt,JEDLZ36,CON
Natural gas,N/A,Dracut MA Wk Tot Vol,IGBDWV4,MMB
Natural gas,UNS,Chicago NIPSCO Tier Mo,CGBFX03,N/A
Natural gas,USD,Pine Prairie Hub Prelim WAvg,PRBRU04,MMB
Natural gas,USD,Stanfield OR Prelim WAvg,PRBCM04,MMB
Natural gas,N/A,TX Eastern E TX Wk Tot Vol,IGBANV4,MMB
Natural gas,USD,Transco Zone 6 Non-NY North Prelim WAvg,PRBJS04,MMB
Natural gas,N/A,Tennessee Zone 6 delivered North Tier Mo,CGBRW03,N/A
Natural gas,UNS,Cheyenne Hub Tier Mo,CGBCO03,UNS
Natural gas,USD,ANR ML 7 FDt Midpoint Prelim MAvg,PSBDQ06,MMB
Natural gas,USD,Millennium East receipts Prelim WAvg,PRBIW04,MMB
Natural gas,UNS,TX Eastern E LA Tier Mo,CGBBS03,UNS
Natural gas,CAD,TC Alb AECO-C FDt Midpt Prelim MAvg,PSBCU06,GIG
Natural gas,N/A,ANR LA Wk Tot Vol,IGBBFV4,MMB
Natural gas,USD,Waha Dlvd to Pipeline SPI,RGBWA56,MMB
Natural gas,N/A,Chicago Peoples Wk Tot Vol,IGBGXV4,MMB
Natural gas,N/A,Emerson Viking Wk Tot Vol,IGBCWV4,MMB
Natural gas,USD,ICE GCX Waha Hub Pool Mo,JAAMZ03,MMB
Natural gas,UNS,Chicago Nicor Tier Mo,CGBEX03,N/A
Natural gas,USD,ANR OK FDt Midpoint Prelim MAvg,PSBBY06,MMB
Natural gas,USD,Transco Leidy Line receipts Prelim WAvg,PRBIS04,MMB
Natural gas,USD,NW S Green River FDt Midpt Prelim MAvg,PSBCQ06,MMB
Natural gas,N/A,TX Eastern S TX Wk Tot Vol,IGBBBV4,MMB
Natural gas,USD,Algonquin CG FDt Midpoint Prelim MAvg,PSBEE06,MMB
Natural gas,UNS,ICE GCX Waha Hub Pool BidWk Dlvd Pipe DlCt,JDDMZ36,CON
Natural gas,USD,Waha FDt Midpoint Prelim MAvg,PSBAD06,MMB
Natural gas,USD,Katy Prelim WAvg,PRBAQ04,MMB
Natural gas,USD,Panhandle TX-OK Prelim WAvg,PRBCE04,MMB
Natural gas,N/A,Niagara Wk Tot Vol,IGBCSV4,MMB
Natural gas,UNS,No Border VentTP Tier Mo,CGBGH03,UNS
Natural gas,N/A,Carthage Hub Wk Tot Vol,IGBAFV4,MMB
Natural gas,N/A,REX Zone 3 delivered Tier Mo,CGBRO03,N/A
Natural gas,USD,Lebanon Hub-Ohio Prelim WAvg,PRBFJ04,MMB
Natural gas,N/A,Chicago NIPSCO Wk Tot Vol,IGBFXV4,MMB
Natural gas,UNS,Chicago CG Tier Mo,CGBDX03,UNS
Natural gas,USD,Pine Prairie Hub FDt Midpt Prelim MAvg,PSBRU06,MMB
Natural gas,USD,Stanfield OR FDt Midpoint Prelim MAvg,PSBCM06,MMB
Natural gas,CAD,Westcoast Stn 2 Prelim WAvg,PRBCZ04,GIG
Natural gas,USD,Transco Zone 6 Non-NY North FDt Midpoint Prelim MAvg,PSBJS06,MMB
Natural gas,N/A,Cheyenne Hub Wk Tot Vol,IGBCOV4,MMB
Natural gas,USD,Millennium East receipts FDt Midpoint Prelim MAvg,PSBIW06,MMB
Natural gas,USD,ICE GCX Waha Hub Pool BidWk Dlvd Pipe,JAAMZ36,MMB
Natural gas,N/A,TX Eastern E LA Wk Tot Vol,IGBBSV4,MMB
Natural gas,USD,California CityGate SPI,RGBCA66,MMB
Natural gas,UNS,Col Gulf LA Tier Mo,CGBBG03,UNS
Natural gas,N/A,Chicago Nicor Wk Tot Vol,IGBEXV4,MMB
Natural gas,N/A,White River Hub Wk Tot Vol,IGBGLV4,MMB
Natural gas,UNS,Dawn Ontario Tier Mo,CGBCX03,UNS
Natural gas,USD,Transco Leidy Line receipts FDt Midpoint Prelim MAvg,PSBIS06,MMB
Natural gas,N/A,Texas Eastern zone M-2 receipts BidWeek Tier Mo,CGBJE03,N/A
Natural gas,USD,Katy FDt Midpoint Prelim MAvg,PSBAQ06,MMB
Natural gas,USD,Panhandle TX-OK FDt Midpt Prelim MAvg,PSBCE06,MMB
Natural gas,N/A,TX Eastern M-1 24-in Wk Tot Vol,IGBETV4,MMB
Natural gas,N/A,No Border VentTP Wk Tot Vol,IGBGHV4,MMB
Natural gas,USD,Transwestn Perm Prelim WAvg,PRBAE04,MMB
Natural gas,UNS,NW Can Bd Sumas Tier Mo,CGBCT03,UNS
Natural gas,N/A,REX Zone 3 delivered Wk Tot Vol,IGBROV4,MMB
Natural gas,USD,Lebanon Hub-Ohio FDt Midpt Prelim MAvg,PSBFJ06,MMB
Natural gas,N/A,Chicago CG Wk Tot Vol,IGBDXV4,MMB
Natural gas,CAD,Westcoast Stn 2 FDt Midpt Prelim MAvg,PSBCZ06,GIG
Natural gas,USD,Rover delivered Prelim WAvg,PRBRV04,MMB
Natural gas,UNS,NW WY Pool/Rky Tier Mo,CGBCP03,UNS
Natural gas,USD,TX Eastern W LA Prelim WAvg,PRBBR04,MMB
Natural gas,N/A,Col Gulf LA Wk Tot Vol,IGBBGV4,MMB
Natural gas,USD,Transwestern-SJ Prelim WAvg,PRBGK04,MMB
Natural gas,USD,Agua Dulce Hub Prelim WAvg,PRBAV04,MMB
Natural gas,UNS,Northwest Wyoming Pool DlCt Mo,BGBDA03,CON
Natural gas,USD,Tennessee Zone 6 delivered North Prelim WAvg,PRBRR04,MMB
Natural gas,N/A,Dawn Ontario Wk Tot Vol,IGBCXV4,MMB
Natural gas,N/A,El Paso West Texas Tier Mo,CGBRT03,N/A
Natural gas,N/A,Texas Eastern zone M-2 receipts Wk Tot Vol,IGBJEV4,MMB
Natural gas,N/A,Alliance Interstates Wk Tot Vol,IGBDPV4,MMB
Natural gas,UNS,ICE Agua Blanca Pool (Intra) DlCt Mo,JDDXZ03,CON
Natural gas,USD,Transwstn Permian FDt Midpt Prelim MAvg,PSBAE06,MMB
Natural gas,USD,Northwest Wyoming Pool BidWk Dlvd Pipe Cash,EGBDA36,MMB
Natural gas,N/A,NW Can Bd Sumas Wk Tot Vol,IGBCTV4,MMB
Natural gas,N/A,ICE El Paso South Mainline Prelim Cumulative BidWk Dlvd Pipe DlCt,JFFFM36,CON
Natural gas,N/A,ICE El Paso San Juan Basin Blanco Pool (Primary only) Prelim Cumulative DlCt Mo,JFFFK03,CON
Natural gas,N/A,ICE El Paso San Juan Basin Blanco Pool (Primary only) Prelim DlCt Mo,JEEFK03,CON
Natural gas,N/A,ICE El Paso San Juan Basin Blanco Pool Prelim Cumulative BidWk Dlvd Pipe DlCt,JFFFK36,CON
Natural gas,N/A,ICE El Paso San Juan Basin Blanco Pool (Primary only) Prelim BidWk Dlvd Pipe DlCt,JEEFK36,CON
Natural gas,USD,ICE El Paso San Juan Basin Blanco Pool (Primary only) Prelim BidWk Dlvd Pipe,JBBFK36,MMB
Natural gas,N/A,ICE El Paso San Juan Basin Bondad Station (Primary only) Prelim Cumulative DlCt Mo,JFFFL03,CON
Natural gas,N/A,ICE El Paso San Juan Basin Bondad Station (Primary only) Prelim DlCt Mo,JEEFL03,CON
Natural gas,USD,ICE El Paso San Juan Basin Bondad Station (Primary only) Prelim Mo,JBBFL03,MMB
Natural gas,N/A,ICE El Paso San Juan Basin Bondad Station Prelim Cumulative BidWk Dlvd Pipe DlCt,JFFFL36,CON
Natural gas,N/A,ICE El Paso San Juan Basin Bondad Station (Primary only) Prelim BidWk Dlvd Pipe DlCt,JEEFL36,CON
Natural gas,USD,ICE El Paso San Juan Basin Bondad Station (Primary only) Prelim BidWk Dlvd Pipe,JBBFL36,MMB
Natural gas,USD,ICE NGPL TXOK East Pool Prelim BidWk Dlvd Pipe,JBBCP36,MMB
Natural gas,N/A,ICE NGPL TXOK West Pool Prelim Cumulative DlCt Mo,JFFCQ03,CON
Natural gas,N/A,ICE NGPL TXOK West Pool Prelim DlCt Mo,JEECQ03,CON
Natural gas,N/A,ICE NGPL Iowa-Illinois GC Pool Prelim Cumulative BidWk Dlvd Pipe DlCt,JFFHN36,CON
Natural gas,USD,ICE NGPL TXOK West Pool Prelim Mo,JBBCQ03,MMB
Natural gas,N/A,ICE NGPL Iowa-Illinois GC Pool Prelim BidWk Dlvd Pipe Dlct,JEEHN36,CON
Natural gas,N/A,ICE NGPL TXOK West Pool Prelim Cumulative BidWk Dlvd Pipe DlCt,JFFCQ36,CON
Natural gas,N/A,ICE NGPL TXOK West Pool Prelim BidWk Dlvd Pipe DlCt,JEECQ36,CON
Natural gas,USD,ICE NGPL TXOK West Pool Prelim BidWk Dlvd Pipe,JBBCQ36,MMB
Natural gas,USD,ICE NGPL TXOK East Pool TDt Abs,JAACP20,MMB
Natural gas,N/A,ICE NGPL Iowa-Illinois AM Pool Prelim Cumulative BidWk Dlvd Pipe DlCt,JFFHO36,CON
Natural gas,N/A,ICE NGPL TXOK East Pool TDt DlCt,JCCCP00,CON
Natural gas,N/A,ICE NGPL Iowa-Illinois GC Storage Prelim Cumulative DlCt Mo,JFFHP03,CON
Natural gas,USD,ICE NGPL TXOK West Pool TDt Abs,JAACQ20,MMB
Natural gas,N/A,ICE NGPL Iowa-Illinois GC Storage Prelim Cumulative BidWk Dlvd Pipe DlCt,JFFHP36,CON
Natural gas,N/A,ICE NGPL Iowa-Illinois GC Storage Prelim BidWk Dlvd Pipe Dlct,JEEHP36,CON
Natural gas,USD,ICE NGPL Iowa-Illinois GC Storage Prelim BidWk Dlvd Pipe,JBBHP36,MMB
Natural gas,N/A,ICE NGPL TXOK West Pool TDt DlCt,JCCCQ00,CON
Natural gas,N/A,ICE NGPL Iowa-Illinois AM Storage Prelim Cumulative DlCt Mo,JFFHQ03,CON
Natural gas,N/A,ICE NGPL TXOK East Pool Prelim Cumulative DlCt Mo,JFFCP03,CON
Natural gas,N/A,ICE NGPL TXOK East Pool Prelim DlCt Mo,JEECP03,CON
Natural gas,N/A,ICE NGPL Iowa-Illinois AM Storage Prelim Cumulative BidWk Dlvd Pipe DlCt,JFFHQ36,CON
Natural gas,N/A,ICE NGPL Iowa-Illinois AM Storage Prelim BidWk Dlvd Pipe Dlct,JEEHQ36,CON
Natural gas,USD,ICE NGPL TXOK East Pool Prelim Mo,JBBCP03,MMB
Natural gas,N/A,ICE NGPL TXOK East Pool Prelim Cumulative BidWk Dlvd Pipe DlCt,JFFCP36,CON
Natural gas,USD,ICE NGPL Iowa-Illinois AM Storage Prelim BidWk Dlvd Pipe,JBBHQ36,MMB
Natural gas,N/A,ICE NGPL TXOK East Pool Prelim BidWk Dlvd Pipe DlCt,JEECP36,CON
Natural gas,USD,ICE Iroquois zone 2 (non-Hunts Point/Eastchester Lateral) Prelim BidWk Dlvd Pipe,JBBBT36,MMB
Natural gas,N/A,ICE Enable Gas South Pool only Prelim Cumulative BidWk Dlvd Pipe DlCt,JFFBH36,CON
Natural gas,N/A,ICE Iroquois zone 2 Hunts Point/Eastchester Lateral Prelim Cumulative DlCt Mo,JFFBU03,CON
Natural gas,N/A,ICE Iroquois zone 2 Hunts Point/Eastchester Lateral Prelim DlCt Mo,JEEBU03,CON
Natural gas,USD,ICE Iroquois zone 2 Hunts Point/Eastchester Lateral Prelim Mo,JBBBU03,MMB
Natural gas,N/A,ICE Iroquois zone 2 Hunts Point/Eastchester Prelim Cumulative BidWk Dlvd Pipe DlCt,JFFBU36,CON
Natural gas,N/A,ICE Iroquois zone 2 Hunts Point/Eastchester Lateral Prelim BidWk Dlvd Pipe DlCt,JEEBU36,CON
Natural gas,USD,ICE Iroquois zone 2 Hunts Point/Eastchester Lateral Prelim BidWk Dlvd Pipe,JBBBU36,MMB
Natural gas,USD,ICE Iroquois zone 2 (non-Hunts Point/Eastchester Lateral) TDt Abs,JAABT20,MMB
Natural gas,N/A,ICE Iroquois zone 2 (non-Hunts Point/Eastchester Lateral) TDt DlCt,JCCBT00,CON
Natural gas,USD,ICE Iroquois zone 2 Hunts Point/Eastchester Lateral TDt Abs,JAABU20,MMB
Natural gas,N/A,ICE Tennessee zone 6 300 Line Dlvd Prelim Cumulative DlCt Mo,JFFFT03,CON
Natural gas,N/A,ICE Tennessee zone 6 300 Line Dlvd Prelim DlCt Mo,JEEFT03,CON
Natural gas,USD,ICE Tennessee zone 6 300 Line Dlvd Prelim Mo,JBBFT03,MMB
Natural gas,N/A,ICE Tennessee zone 6 300 Line Dlvd Prelim Cumulative BidWk Dlvd Pipe DlCt,JFFFT36,CON
Natural gas,N/A,ICE Tennessee zone 6 300 Line Dlvd Prelim BidWk Dlvd Pipe DlCt,JEEFT36,CON
Natural gas,USD,ICE Tennessee zone 6 300 Line Dlvd Prelim BidWk Dlvd Pipe,JBBFT36,MMB
Natural gas,N/A,ICE Iroquois zone 2 (non-Hunts Point/Eastchester Lateral) Prelim Cumulative DlCt Mo,JFFBT03,CON
Natural gas,N/A,ICE Iroquois zone 2 (non-Hunts Point/Eastchester Lateral) Prelim DlCt Mo,JEEBT03,CON
Natural gas,USD,ICE Iroquois zone 2 (non-Hunts Point/Eastchester Lateral) Prelim Mo,JBBBT03,MMB
Natural gas,N/A,ICE Iroquois zone 2 (non-Hunts Pt./Eastchester) Prelim Cumulative BidWk Dlvd Pipe DlCt,JFFBT36,CON
Natural gas,N/A,ICE Texas Gas North Louisiana Pool Prelim Cumulative BidWk Dlvd Pipe DlCt,JFFEY36,CON
Natural gas,N/A,ICE Iroquois zone 2 (non-Hunts Point/Eastchester Lateral) Prelim BidWk Dlvd Pipe DlCt,JEEBT36,CON
Natural gas,N/A,ICE Tennessee zone 0 South Prelim Cumulative BidWk Dlvd Pipe DlCt,JFFEQ36,CON
Natural gas,N/A,ICE Tennessee zone 0 South Prelim BidWk Dlvd Pipe DlCt,JEEEQ36,CON
Natural gas,N/A,ICE Transco zone 5 delivered Prelim Cumulative DlCt Mo,JFFFV03,CON
Natural gas,N/A,ICE Transco zone 6 Non-NY Prelim Cumulative DlCt Mo,JFFEZ03,CON
Natural gas,N/A,ICE Transco zone 5 delivered Prelim DlCt Mo,JEEFV03,CON
Natural gas,N/A,ICE Transco zone 6 Non-NY Prelim DlCt Mo,JEEEZ03,CON
Natural gas,USD,ICE Tennessee zone 0 South Prelim BidWk Dlvd Pipe,JBBEQ36,MMB
Natural gas,USD,ICE Transco zone 5 delivered Prelim Mo,JBBFV03,MMB
Natural gas,N/A,ICE Transco zone 5 delivered Prelim Cumulative BidWk Dlvd Pipe DlCt,JFFFV36,CON
Natural gas,USD,ICE Transco zone 6 Non-NY Prelim Mo,JBBEZ03,MMB
Natural gas,N/A,ICE Transco zone 6 Non-NY Prelim Cumulative BidWk Dlvd Pipe DlCt,JFFEZ36,CON
Natural gas,N/A,ICE Transco zone 5 delivered Prelim BidWk Dlvd Pipe DlCt,JEEFV36,CON
Natural gas,N/A,ICE Transco zone 6 Non-NY Prelim BidWk Dlvd Pipe DlCt,JEEEZ36,CON
Natural gas,USD,ICE Transco zone 5 delivered Prelim BidWk Dlvd Pipe,JBBFV36,MMB
Natural gas,USD,ICE Transco zone 6 Non-NY Prelim BidWk Dlvd Pipe,JBBEZ36,MMB
Natural gas,N/A,ICE Kern River receipt Prelim Cumulative BidWk Dlvd Pipe DlCt,JFFCA36,CON
Natural gas,N/A,ICE Opal Plant Tailgate Prelim Cumulative BidWk Dlvd Pipe DlCt,JFFDB36,CON
Natural gas,USD,ICE Transco zone 6 Non-NY Prelim TDt Abs,JBBEZ20,MMB
Natural gas,USD,ICE Transco zone 6 Non-NY TDt Abs,JAAEZ20,MMB
Natural gas,N/A,ICE Transco zone 6 Non-NY Prelim FDt DlCt,JDDEZ21,CON
Natural gas,N/A,ICE Transco zone 6 Non-NY FDt DlCt,JCCEZ21,CON
Natural gas,N/A,ICE Tennessee zone 0 North Prelim Cumulative DlCt Mo,JFFEP03,CON
Natural gas,USD,ICE Transco zone 6 Non-NY Prelim FDt Com,JBBEZ21,MMB
Natural gas,N/A,ICE Transco zone 6 Non-NY Prelim TDt DlCt,JDDEZ00,CON
Natural gas,N/A,ICE Transco zone 6 Non-NY TDt DlCt,JCCEZ00,CON
Natural gas,USD,ICE Transco zone 6 Non-NY Prelim TDt Com,JBBEZ00,MMB
Natural gas,N/A,ICE Cove Point Receipt Gas on the Cove Point Pipeline Prelim Cumulative DlCt Mo,JFFHM03,CON
Natural gas,N/A,ICE Tennessee zone 0 North Prelim Cumulative BidWk Dlvd Pipe DlCt,JFFEP36,CON
Natural gas,N/A,ICE Tennessee zone 0 North Prelim BidWk Dlvd Pipe DlCt,JEEEP36,CON
Natural gas,USD,ICE Transco zone 6 Non-NY Prelim FDt Abs,JBBEZ22,MMB
Natural gas,USD,ICE Transco zone 6 Non-NY FDt Abs,JAAEZ22,MMB
Natural gas,USD,ICE Tennessee zone 0 North Prelim BidWk Dlvd Pipe,JBBEP36,MMB
Natural gas,N/A,ICE Cove Point Receipt Gas on the Cove Point Pipeline Prelim Cum BidWk Dlvd Pipe DlCt,JFFHM36,CON
Natural gas,N/A,ICE Cove Point Receipt Gas on the Cove Point Pipeline Prelim BidWk Dlvd Pipe DlCt,JEEHM36,CON
Natural gas,N/A,ICE Tennessee zone 0 South Prelim Cumulative DlCt Mo,JFFEQ03,CON
Natural gas,USD,ICE Cove Point Receipt Gas on the Cove Point Pipeline Prelim BidWk Dlvd Pipe,JBBHM36,MMB
Natural gas,N/A,ICE NGPL TXOK East Storage (Gulf Coast) PIN 25658 Prelim DlCt Mo,JEEGA03,N/A
Natural gas,N/A,ICE Tennessee zone 5 200 Line dlvd station 245 Prelim BidWk Dlvd Pipe DlCt,JEEEU36,CON
Natural gas,USD,ICE Texas Eastern M1 24 inch Prelim BidWk Dlvd Pipe,JBBFU36,MMB
Natural gas,N/A,ICE NGPL TXOK East Storage (Gulf Coast) PIN 25658 DlCt Mo,JDDGA03,N/A
Natural gas,N/A,ICE Bobcat Storage Prelim Cumulative BidWk Dlvd Pipe DlCt,JFFAP36,CON
Natural gas,N/A,ICE Moss Bluff Interconn (buyers' choice dlvd) Prelim Cumulative BidWk Dlvd Pipe DlCt,JFFCD36,CON
Natural gas,N/A,ICE Moss Bluff Interconnect (buyers' choice dlvd) Prelim BidWk Dlvd Pipe DlCt,JEECD36,CON
Natural gas,USD,ICE Tennessee zone 5 200 Line dlvd downstream of station 245 Prelim BidWk Dlvd Pipe,JBBEU36,MMB
Natural gas,N/A,ICE NGPL TXOK East Storage (Gulf Coast) PIN 25658 Prelim Cumulative Basis DlCt Mo,JFFGA36,N/A
Natural gas,N/A,ICE NGPL TXOK East Storage (Gulf Coast) PIN 25658 Prelim Basis DlCt Mo,JEEGA36,N/A
Natural gas,N/A,ICE NGPL TXOK East Storage (Gulf Coast) PIN 25658 DlCt Mo Basis,JDDGA36,N/A
Natural gas,USD,ICE Maritimes and Northeast Pipeline US TDt Abs,JAACC20,MMB
Natural gas,N/A,ICE Northwest Rocky Mountain Pool Prelim Cumulative BidWk Dlvd Pipe DlCt,JFFFR36,CON
Natural gas,N/A,ICE Algonquin Millennium-Ramapo receipts Prelim Cumulative BidWk Dlvd Pipe DlCt,JFFHF36,CON
Natural gas,N/A,ICE Northwest Rocky Mountain Pool Prelim BidWk Dlvd Pipe DlCt,JEEFR36,CON
Natural gas,N/A,ICE Tennessee zone 1 100 Leg Pool Prelim Cumulative BidWk Dlvd Pipe DlCt,JFFER36,CON
Natural gas,N/A,ICE Moss Bluff Storage Prelim Cumulative BidWk Dlvd Pipe DlCt,JFFCE36,CON
Natural gas,N/A,ICE Dracut Interconnect - Maritimes Tenn PDX Prelim Cumulative BidWk Dlvd Pipe DlCt,JFFFJ36,CON
Natural gas,N/A,ICE Jefferson Island Storage and Hub Prelim Cumulative DlCt Mo,JFFBV03,CON
Natural gas,N/A,ICE Dracut Interconnect - Maritimes Tennessee Portland Prelim BidWk Dlvd Pipe DlCt,JEEFJ36,CON
Natural gas,N/A,ICE Algonquin CG (Excl J-Lat & G-Lat del & Brookfield) Prelim Cum DlCt Mo,JFFAA03,CON
Natural gas,N/A,ICE Sonat Zone 0 South Louisiana Pool Prelim Cumulative BidWk Dlvd Pipe DlCt,JFFEJ36,CON
Natural gas,N/A,ICE HPL East Texas Pool Prelim Cumulative DlCt Mo,JFFBR03,CON
Natural gas,N/A,ICE Maritimes and Northeast Pipeline US TDt DlCt,JCCCC00,CON
Natural gas,N/A,ICE ANR SE Transmission Pool Prelim Cumulative BidWk Dlvd Pipe DlCt,JFFAI36,CON
Natural gas,N/A,ICE Algonquin CG (Excl J-Lat & G-Lat del & Brookfield) Prelim DlCt Mo,JEEAA03,CON
Natural gas,N/A,ICE Sonat Zone 0 South Louisiana Pool Prelim BidWk Dlvd Pipe DlCt,JEEEJ36,CON
Natural gas,USD,ICE Dracut Interconnect - Maritimes Tennessee Portland Prelim BidWk Dlvd Pipe,JBBFJ36,MMB
Natural gas,N/A,ICE Jefferson Island Storage and Hub Prelim Cumulative BidWk Dlvd Pipe DlCt,JFFBV36,CON
Natural gas,USD,ICE Algonquin CG (Excl J-Lat & G-Lat del & Brookfield) Prelim Mo,JBBAA03,MMB
Natural gas,N/A,ICE Egan Interconnect (buyers' choice dlvd) Prelim Cumulative BidWk Dlvd Pipe DlCt,JFFAZ36,CON
Natural gas,N/A,ICE Jefferson Island Storage and Hub Prelim BidWk Dlvd Pipe DlCt,JEEBV36,CON
Natural gas,N/A,ICE Algonquin CG (Excl J-Lat & G-Lat del & Brookfield) Prelim Cum BidWk Dlvd Pipe DlCt,JFFAA36,CON
Natural gas,N/A,ICE Egan Interconnect (buyers' choice delivered) Prelim BidWk Dlvd Pipe DlCt,JEEAZ36,CON
Natural gas,N/A,ICE HPL East Texas Pool Prelim Cumulative BidWk Dlvd Pipe DlCt,JFFBR36,CON
Natural gas,N/A,ICE Maritimes Hubline and Beverly Salem Prelim Cumulative DlCt Mo,JFFCB03,CON
Natural gas,N/A,ICE Algonquin CG (Excl J-Lat & G-Lat del & Brookfield) Prelim BidWk Dlvd Pipe DlCt,JEEAA36,CON
Natural gas,N/A,ICE ENT STX Map Prelim Cumulative DlCt Mo,JFFHT03,CON
Natural gas,N/A,ICE Texas Eastern Manhattan Lateral Dlvd Prelim Cumulative BidWk Dlvd Pipe DlCt,JFFEW36,CON
Natural gas,USD,ICE NGPL TXOK East Storage (Gulf Coast) PIN 25658 TDt Abs,JAAGA20,MMB
Natural gas,N/A,ICE HPL East Texas Pool Prelim BidWk Dlvd Pipe DlCt,JEEBR36,CON
Natural gas,N/A,ICE Texas Eastern Manhattan Lateral Dlvd Prelim BidWk Dlvd Pipe DlCt,JEEEW36,CON
Natural gas,USD,ICE Jefferson Island Storage and Hub Prelim BidWk Dlvd Pipe,JBBBV36,MMB
Natural gas,N/A,ICE Tennessee zone 1 Station 87 Pool Prelim Cumulative BidWk Dlvd Pipe DlCt,JFFES36,CON
Natural gas,USD,ICE Algonquin CG (Excl J-Lat & G-Lat del & Brookfield) Prelim BidWk Dlvd Pipe,JBBAA36,MMB
Natural gas,N/A,ICE Tennessee zone 1 Station 87 Pool Prelim BidWk Dlvd Pipe DlCt,JEEES36,CON
Natural gas,USD,ICE HPL East Texas Pool Prelim BidWk Dlvd Pipe,JBBBR36,MMB
Natural gas,N/A,ICE Stingray pool delivery Prelim Cumulative BidWk Dlvd Pipe DlCt,JFFEO36,CON
Natural gas,N/A,ICE Maritimes Hubline and Beverly Salem Prelim Cumulative BidWk Dlvd Pipe DlCt,JFFCB36,CON
Natural gas,N/A,ICE NGPL TXOK East Storage (Gulf Coast) PIN 25658 FDt DlCt,JCCGA21,N/A
Natural gas,N/A,ICE ENT STX Map Prelim Cumulative BidWk Dlvd Pipe DlCt,JFFHT36,CON
Natural gas,N/A,ICE Maritimes Hubline and Beverly Salem Prelim BidWk Dlvd Pipe DlCt,JEECB36,CON
Natural gas,N/A,ICE Algonquin Citygates (Excl. J Lateral deliveries) Prelim Cumulative DlCt Mo,JFFAB03,CON
Natural gas,N/A,ICE ENT STX Map Prelim BidWk Dlvd Pipe Dlct,JEEHT36,CON
Natural gas,USD,ICE NGPL TXOK East Storage (Gulf Coast) PIN 25658 FDt,JAAGA21,MMB
Natural gas,N/A,ICE NGPL TXOK East Storage (Gulf Coast) PIN 25658 TDt DlCt,JCCGA00,N/A
Natural gas,N/A,ICE Gulf South Perryville Exchange Point Prelim Cumulative DlCt Mo,JFFBO03,CON
Natural gas,USD,ICE Maritimes Hubline and Beverly Salem Prelim BidWk Dlvd Pipe,JBBCB36,MMB
Natural gas,USD,ICE ENT STX Map Prelim BidWk Dlvd Pipe,JBBHT36,MMB
Natural gas,USD,ICE NGPL TXOK East Storage (Gulf Coast) PIN 25658 TDt,JAAGA00,MMB
